{
  "term": "Location Tracking",
  "slug": "location-tracking",
  "definition": "The collection and monitoring of a device's or person's geographical position over time, typically through GPS, cellular towers, Wi-Fi networks, or other positioning technologies.",
  "metaDescription": "Learn about location tracking - how apps and services monitor your geographical position, privacy implications, and ways to protect your location data.",
  "simpleExplanation": "Location tracking is when your phone, apps, or online services keep track of where you are and where you go. This happens through GPS, cell towers, and Wi-Fi signals that can pinpoint your exact location and create a detailed map of your daily movements.",
  "whyItMatters": "Your location data reveals intimate details about your life - where you live, work, shop, and socialize. This information can be sold to advertisers, shared with governments, or used to infer personal details like your health conditions, political views, or relationships.",
  "technicalDetail": "Location tracking combines multiple data sources including GPS coordinates, cell tower triangulation, Wi-Fi access point mapping, and IP address geolocation. Apps can access this data through device APIs, while web services use IP addresses and browser geolocation features to determine approximate location.",
  "examples": [
    {
      "scenario": "Maps and Navigation Apps",
      "explanation": "Apps like Google Maps track your location to provide turn-by-turn directions and estimate arrival times, but also build detailed profiles of your travel patterns and frequently visited places."
    },
    {
      "scenario": "Social Media Check-ins",
      "explanation": "When you post photos or check-in at restaurants on social platforms, you're sharing your location data, which can be used to target ads or build location-based audience profiles."
    },
    {
      "scenario": "Fitness and Health Apps",
      "explanation": "Running apps track your routes and workout locations, potentially revealing sensitive information like your home address or daily exercise routine to the app company and their partners."
    }
  ],
  "relatedTerms": [
    "geofencing",
    "behavioral-tracking",
    "data-broker",
    "metadata",
    "ip-address"
  ],
  "category": "technology",
  "editorial": {
    "status": "published",
    "reviewedAt": "2026-05-18T23:39:59.780Z",
    "reviewedBy": "Darkpool David",
    "notes": "Bulk-promoted after R3 product-mention scrub + editorial-gate rollout. Pseudonymous byline."
  },
  "author": {
    "name": "Darkpool David",
    "bio": "Privacy & browser-security writer",
    "credentials": "Writes pseudonymously. 10+ years following the consumer browser-privacy and surveillance-economy beat. Editorial voice behind the incognitobrowser.io resource library and supporting publications.",
    "profileUrl": "https://incognitobrowser.io/resources/authors/darkpool-david/"
  }
}
