{
  "term": "Data Broker",
  "slug": "data-broker",
  "definition": "A company that collects, aggregates, and sells personal information about individuals from various sources without direct consumer interaction.",
  "metaDescription": "Learn about data brokers - companies that collect and sell your personal information. Understand how they operate and impact your privacy.",
  "simpleExplanation": "Data brokers are like digital middlemen who gather information about you from public records, websites, apps, and other sources, then package and sell this data to other companies for marketing, background checks, or other purposes.",
  "whyItMatters": "Data brokers can create detailed profiles about you without your knowledge or consent, potentially affecting everything from the ads you see to your insurance rates, employment opportunities, and loan approvals.",
  "technicalDetail": "Data brokers use automated systems to scrape public records, purchase data from retailers and websites, track online behavior through partnerships, and combine datasets using matching algorithms based on names, addresses, emails, and device identifiers to create comprehensive consumer profiles.",
  "examples": [
    {
      "scenario": "Marketing profiles",
      "explanation": "Acxiom and Epsilon collect purchase history, demographics, and online behavior to create marketing segments like 'suburban families' or 'luxury shoppers' sold to advertisers."
    },
    {
      "scenario": "People search sites",
      "explanation": "Whitepages, Spokeo, and BeenVerified aggregate public records, social media, and other sources to create searchable profiles with addresses, phone numbers, and family connections."
    },
    {
      "scenario": "Risk assessment",
      "explanation": "LexisNexis Risk Solutions sells data to insurance companies and employers for background checks, helping them assess risk or verify identity during applications."
    }
  ],
  "relatedTerms": [
    "data-mining",
    "behavioral-tracking",
    "digital-footprint",
    "gdpr",
    "ccpa"
  ],
  "niche": "Commercial data collection and sale",
  "category": "concept",
  "editorial": {
    "status": "published",
    "reviewedAt": "2026-05-18T23:39:59.780Z",
    "reviewedBy": "Darkpool David",
    "notes": "Bulk-promoted after R3 product-mention scrub + editorial-gate rollout. Pseudonymous byline."
  },
  "author": {
    "name": "Darkpool David",
    "bio": "Privacy & browser-security writer",
    "credentials": "Writes pseudonymously. 10+ years following the consumer browser-privacy and surveillance-economy beat. Editorial voice behind the incognitobrowser.io resource library and supporting publications.",
    "profileUrl": "https://incognitobrowser.io/resources/authors/darkpool-david/"
  }
}
