{
  "term": "Data Protection Officer",
  "slug": "data-protection-officer",
  "definition": "A designated privacy professional responsible for ensuring an organization complies with data protection laws and acts as a point of contact for data protection authorities.",
  "metaDescription": "Learn about Data Protection Officers (DPOs) - privacy professionals who ensure GDPR compliance and protect personal data in organizations.",
  "simpleExplanation": "A Data Protection Officer (DPO) is like a privacy guardian within a company. They make sure the organization follows data protection laws, trains employees on privacy rules, and handles privacy complaints from customers.",
  "whyItMatters": "DPOs help protect your personal information by ensuring companies handle data responsibly. They serve as your advocate within organizations, investigating privacy concerns and making sure your rights are respected.",
  "technicalDetail": "DPOs must have expert knowledge of data protection law and practices, report directly to senior management, operate independently without conflicts of interest, and maintain professional secrecy. They conduct privacy impact assessments, monitor compliance through audits, and serve as the primary contact for supervisory authorities during investigations.",
  "examples": [
    {
      "scenario": "Hospital DPO reviewing patient records system",
      "explanation": "A hospital's DPO ensures that electronic health records comply with HIPAA regulations, conducting regular audits of who accesses patient data and implementing proper security measures."
    },
    {
      "scenario": "Tech company launching new app",
      "explanation": "Before releasing a social media app, the company's DPO reviews the privacy features, ensures GDPR compliance, and creates clear privacy notices explaining how user data will be processed."
    },
    {
      "scenario": "Customer filing privacy complaint",
      "explanation": "When a customer believes their data was misused, they can contact the DPO directly to investigate the issue and ensure their data subject access request is properly handled."
    }
  ],
  "relatedTerms": [
    "gdpr",
    "privacy-impact-assessment",
    "data-subject-access-request",
    "privacy-by-design",
    "data-minimization"
  ],
  "category": "concept",
  "editorial": {
    "status": "published",
    "reviewedAt": "2026-05-18T23:39:59.780Z",
    "reviewedBy": "Darkpool David",
    "notes": "Bulk-promoted after R3 product-mention scrub + editorial-gate rollout. Pseudonymous byline."
  },
  "author": {
    "name": "Darkpool David",
    "bio": "Privacy & browser-security writer",
    "credentials": "Writes pseudonymously. 10+ years following the consumer browser-privacy and surveillance-economy beat. Editorial voice behind the incognitobrowser.io resource library and supporting publications.",
    "profileUrl": "https://incognitobrowser.io/resources/authors/darkpool-david/"
  }
}
